{
  "schema": "harness-starter@1",
  "starter_id": "customer-agent",
  "version": "1.0.0",
  "project": "harness-project.json",
  "skill_contracts": [
    "skills/customer-agent-audit.json",
    "skills/customer-agent-module-audit.json",
    "skills/customer-agent-architecture-review.json",
    "skills/customer-agent-repair.json",
    "skills/customer-agent-adversarial-review.json",
    "skills/customer-agent-standards-gate.json",
    "skills/customer-agent-context-audit.json"
  ],
  "skill_entrypoints": {
    "customer-agent-audit": "skill-implementations/customer-agent-audit/SKILL.md",
    "customer-agent-module-audit": "skill-implementations/customer-agent-module-audit/SKILL.md",
    "customer-agent-architecture-review": "skill-implementations/customer-agent-architecture-review/SKILL.md",
    "customer-agent-repair": "skill-implementations/customer-agent-repair/SKILL.md",
    "customer-agent-adversarial-review": "skill-implementations/customer-agent-adversarial-review/SKILL.md",
    "customer-agent-standards-gate": "skill-implementations/customer-agent-standards-gate/SKILL.md",
    "customer-agent-context-audit": "skill-implementations/customer-agent-context-audit/SKILL.md"
  },
  "workflows": [
    "workflows/customer-agent-overall-audit.json",
    "workflows/customer-agent-module-audit.json",
    "workflows/customer-agent-architecture-review.json",
    "workflows/customer-agent-repair-and-prove.json",
    "workflows/customer-agent-repair-with-ci.json",
    "workflows/customer-agent-full-dev.json"
  ],
  "compositions": [
    "compositions/customer-agent-audit-with-standards.json",
    "compositions/customer-agent-module-audit-with-context.json"
  ],
  "entrypoints": {
    "overall_audit": "customer-agent-audit-with-standards",
    "module_audit": "customer-agent-module-audit-with-context",
    "architecture_review": "customer-agent-architecture-review",
    "repair_and_prove": "customer-agent-repair-and-prove",
    "repair_with_ci": "customer-agent-repair-with-ci",
    "full_dev": "customer-agent-full-dev"
  },
  "policies": {
    "standalone_application": true,
    "automatic_merge": false
  }
}
